country,name,address
PK,BOX RING,"MAQBOOL ROAD ,NOAL MORE OPP WAZIRABAD ROAD, Sialkot, 51310, Punjab"
ES,"Industrias Químicas Perlacos, S.L.","c/ Berlin, 33 - Pol. Ind., Torres de la Alameda, 28813, Madrid"
CN,"Jiangsu Feilong Plastic Co., Ltd ","NO.158 HUBIN SOUTH ROAD ,LUJIAXIANG, NIUTANG TOWN, WUJIN DISTRICT, ChangZhou, 213168, Jiangsu"
CZ,A.Schmied s.r.o.,"Husova 560, PO-Box 42, Trhove Sviny, 37401, Jihocesky"
JP,Daitatsu Co Ltd,"111, Gohmae, Ojima-Cho, Nishio, 445-0006, Aichi"
PR,Protego,"147 Comercio Avenue, Hatillo, 659, Hatillo"
EG,FUTURE FASHION,"92 A-1st industrial Zone, (Free Zone), Giza, 12581, 6th of October"
CN,"ZhuJi HuaLiDa Knitting and Textile Co., Ltd.","Chuntang West Village,, Caota Town,, Zhuji City, 311812, Zhejiang"
GT,Mata Textiles S.A.,"KM 16.5 Carretera A San Juan Scatepequez, Parque Industrial Mixco Norte Lote C10-11 , Mixco, 1006, Guatemala"
CN,"Shanghai Qianrun Garments Co., Ltd","No.233, Lane1888, Daye Road,, WuQiao Industrial Zone,, FengXian District,, Shanghai, 201402, Shanghai Shi"
SV,Textiles Opico SA de CV,"KM 31.4 Carretera a Santa Ana, San Juan Opico, 1101, La Libertad"
VN,"PHI Co., Ltd.","No. 10, Dai An Industrial Zone, Tu Minh , Hai Duong, 17000, Hai Duong"
CN,Regina Miracle Intimate Apparel (Shenzhen) Ltd.,"No.5 Cengyao Industrial Estate Yulu, Gongming Baoan ,Shenzhen,Guangdong, P.R.China , Gongming Yulu, Bao'an District, Shenzhen, 518132, Guangdong"
CN,"Shanghai Weijie Garment Co., Ltd.","No. of 1228, Huiping Road,, Nanxiang Town, Jiading District, Shanghai, 201802, Shanghai"
CN,ZHUCHENG HENGWEI CLOTHING CO.LTD,"Southern head of east ourter ring, Shandong Province, Zhucheng City, 262200, Shandong"
ID,PT. Kanindo Makmur Jaya,"Jl. Raya Jepara Kudus KM 19,, Ds. Pendosawalan,, Kecamatan Kalinyamatan, Kabupaten Jepara, 59462, Jawa Tengah"
CN,"Kunshan Gea-Reach Garments Co., Ltd.","No.577 Jiguang North Road, Shipu Qiandeng Town, Kunshan, 215343, Jiangsu"
CN,MOLTEN SPORTS (SIHONG) CORPORATION,"28 Hongyuan Road , Sihong Economic Development Zone, Suqian, 223900, Jiangsu"
CA,CYC Manufacturing,"68 East 1st Ave, Vancouver, V5T 1A1, British Columbia"
CN,CHANGSHU KINSEI FASHION CO LTD,"No.1 MEIBEI RD, MEILI TOWN,, CHANGSHU, 215511, Jiangsu"
CN,FOSHAN SHUNDE STRATEGIC GARMENT LTD,"Chencun Industrial Park, Shun De, Fo Shan, 528313, Guangdong"
MX,"Forta Lab, S.A. de C.V.","Av. Central 206, Manzana 2, Parque Industrial Toluca 2000, Toluca, 50233, Toluca"
CN,Qingdao Kiyomoto Suhlim Bags Co Ltd,"Dongjie Village, Lingshanwei Town, Jiaonan City, Qingdao, 266427, Shandong"
CN,Rich Policy (Zheng Yang Sporting Goods Co Ltd),"NO.1 Hou Dao Road East, San Tun Industrial park, HouJie Town, Dongguan, 523941, Guangdong"
CN,"Shanghai Songjiang ACE luggage Co.,Ltd","2589Shebei Road, Sheshan Town, Songjiang District, Shanghai, 201602, Shanghai Shi"
CN,"SHISHI  HENGCHANG  SPORTS  GOODS  TRADE  CO.,LTD","ZONGSAN   INDUSTRIAL   AREA,, GANGBIAN,YONGNING TOWN,, SHISHI CITY,, Quanzhou, 362700, Fujian"
CN,Universe Ind & Development (ShenZhen) Co Ltd,"446, Songbai Road, Gongming Street, Guangming New District, Shenzhen,  518106, Guangdong"
CN,Yancheng Charlotte Socks Co. Ltd,"NO. 188 YINGBIN AVENUE, XIANGSHUI CITY, Yancheng, 224600, Jiangsu"
CN,ZHANGJIAGANG DONGDU TEO GARMENT CO. LTD. (NEW),"NO.638 JINGANG DA DAO, ZHANGJIAGANG CITY, 215600, Jiangsu"
US,Boathouse,"425 E. Hunting Park Avenue, Philadelphia, Philadelphia, 19124, Pennsylvania"
CN,Zhejiang Wenti Socks Co Ltd,"No. 28 Zhisheng Rd, CaoTa County, Zhuji, 311812, Zhejiang"
CN,"Zhuji Quanneng Knitting Co., Ltd.","NO22 Tianyuan Rd Lingshui Caota, Zhuji, 311812, Zhejiang"
EG,ELITE MERCHANDISING CORP.,"St. 8, El-Amrya Public Free Zone, Alexandria, 23512, Iskandariyah"
DE,Zellaerosol GmbH,"Wiesenstrasse 13, Zell im Wiesental, 79669, Baden-Wuerttemberg"
TW,Canmes Sport Co Ltd,"No 565, Jhongshan Rd., Baihe District, Tainan , 73258, Taiwan"
ID,PT Semarang Garment,"Jl. Soekarno - Hatta KM. 25, Kelurahan Wujil, Kecamatan Bergas, Kabupaten Semarang, 50552, Jawa Tengah"
IT,Alialux Srl,"Via Napoli 42, Angera, 21021, Lombardia"
JP,"Mitsubishi Pencil Co.,Ltd. Gunma Factory","1091, Tateishi, Fujioka, 375-8051, Gunma"
TW,"Jiuh Shin Co., LTD","40-19, Bo Kon Kun, Shi-Fu Village, Shan Yih Hsiang, Miaoli Hsien, 36744, Taiwan"
MC,COTY Monaco,"6 Avenue Prince Albert II, Monaco, 98000, "
PK,Capital Sports Corporation (PVT) Ltd,"Capital Sports Corporation (PVT) Ltd, Kashmir Road, Pacca Garha, Sialkot, 51310, Punjab"
PK,"Multi Sports Textile Pvt., Ltd.","29, K.M G.T Road Muridke, Muridke, 39000, Punjab"
PL,Multi Packaging Solutions Tczew SP. Z.o.o.,"ul. Malinowska 43, Tczew, 83-100, Pomorskie"
LK,Hirdaramani Garments Katunayake (pvt) Ltd (Cutting),"Ring Road 01, Export Process Zone, Katunayake, 112, Western"
TW,Everstrong Spring Industry Co Ltd,"No 45, Sec 4, Fu San Road, Fu Hsing Township, Changhua County, Chang Hua Hsien, 50602, "
TW,"MING HSING LEATHER CO., LTD.","403, Sec. 2, SHA-TIEN ROAD, TA-TU, TAICHUNG, TAIWAN, Taichung, 43242, Taiwan"
TW,Torng Yaw Co. Ltd.,"No. 49, Alley 3, Lane 217, Chung Cheng Road, Yung Kang District, Tainan City, 71043, Taiwan"
TH,"Thai Daizo Aerosol Co.,Ltd.","700/372 Moo 6, Tambol Nongmaidaeng, Amphur Muang, 20000, Chon Buri"
US,1v1 Fight Gear,"5320 Tower Way, Sanford, 32773, Florida"
VN,"An Phat Invest Joint Stock Company -  Zone A ( Unit  2, 3, 4)","Tam Quan Industrial Park, Tam Quan Town, Hoai Nhon District, Quy Nhon, 820000, Binh Dinh"
VN,"FORMOSA (VIETNAM) TEXTILE INDUSTRY CO., LTD","MY XUAN A2 INDUSTRIAL ZONE, TAN THANH DISTRICT, BA RIA VUN TAU PROVINCE, BA RIA  VUNG TAU, 790000, Ba Ria-Vung Tau"
VN,PUNGKOOK SAIGON III Co Ltd,"1A QUARTER, AN PHU WARD,, Thuan An Town, Binh Duong, 820000, Binh Duong"
VN,"Yegin Industrial (Vietnam) Co., Ltd.","Lot 36A,37A, Long Giang Industrial Park, Tan Lap 1 Commune, Tan Phuoc District, Tien Giang Province, Tan Phuoc District, Tien Giang"
CN,JIANGXI NEW STAR ENTERPRISE CO LTD.,"Wanxin Management Area, Pingxiang Economic Development Zone, Pingxiang, 337000, Jiangxi"
TW,Sunever Eyewear Co LTD,"42, Lane 220, SEC.2 Gongxue RD., Annan District, Tainan City, 70947, "
CN,LF Beauty Manufacturing China,"No.1, Street 5, Jinhe Industrial District, Yu Feng Village, Zhangmutou Town, Dong Guan, 523627, Guangdong"
CN,Liaoyuan Northeast Socks Business Group Ltd,"Northeast hosiery park ,Liaoyuan Economic Development Zone ,Liaoyuan , Jilin, Liaoyuan, 136200, Jilin"
AT,MONTFORT Kunststofftechnik GmbH,"Bundesstraße 15, Koblach, 6842, "
KH,Yorks (Cambodia) Co Ltd,"National Road No.1, Tai Seng SEZ, Sangkat Bavet, Bavet, N/A, Svay Rieng"
MX,"Laboratorios Aerosol, S.A. de C.V.","Calle Transformación, Parque Industrial PYME Capulhuac,, Localidad Agua Blanca, Km 9.5 Carretera Ocoyoacac, Santiago Tiangusitenco, Municipio de Capulhuac, 52700, Mexico"
CN,"DADA WUXI Accessories Co.,Ltd","No.33,Deng Street,Hongdon Village,Gushan Town, Jiangyin, 214400, Jiangsu"
CN,Dongguan Bin Bin Fashion Co Ltd,"49 ZhongXing Road, Renzhonggang Industrial Zone, BeiZha, Hu Men Town, Dongguan, 523000, Guangdong"
CN,"Fujian Jinjiang Shenhu Dali Clothing And Knitting Co,.Ltd","Dong An, Shenhu Town, Jinjiang City, 362246, Fujian"
CN,Guangzhou Panyu Dong Chong Chong Ming Glove Factory,"No. 43-5, Ji Xiang Wei Nan Street,, Dong Chong Town, Nansha District, Guangzhou, 511453, Guangdong"
CN,Hengdian Lucheng Knitting Garment Factory,"No.9, Changsheng Road, Hengdian Town, Dongyang City, 322118, 1, 322118, Zhejiang"
CN,"NingBo AiQiOu Garment Co., Ltd.","No. 111 XiaoGao West Road, XinXing Industrial Park , ShouNan Street , Ningbo, 315194, Zhejiang"
CN,"Ningbo Sunful Travelling Goods Co,Ltd","No 46 Hongxiang Rd, Hongtang Industrial Zone A, Jiangbei District, Ningbo, 315033, Zhejiang"
CN,QINGDAO XINZHOU SPORT PRODUCTS CO LTD,"HONGSHIYA TOWN, HUANGDAO DISTRICT, Qingdao, 266000, Shandong"
CN,"Shanghai Nikki Fashion Co., Ltd.","189 Beidou Road, Minhang Economic & Technological Developement Zone, Shanghai, 200245, Shanghai"
CN,SHENYANG DASON SEWING Co. Ltd.,"Xiahewan Village, Hunezhan Town, Dongling District, SHENYANG, 110101, Liaoning"
CN,"SHISHI YAOTIAN SPORTS GOODS. CO.,LTD.","THE THIRD INDUSTRIAL ZONE YONGNING TOWN, SHISHI , FUJIAN P.R. CHINA, SHISHI, 362700, Fujian"
CN,"SUZHOU  HAOLILAI GARMENT CO.,LTD","NO.5-1, YOU XIANG ROAD, WUZHONG DISTRICT, SUZHOU, 215104, Jiangsu"
CN,Xiamen Kingland Apparel Co Ltd,"2F, J5 Building, Yongquan Industrial Area, Guankou, Jimei, Xiamen, 361023, Fujian"
CN,Xuancheng Naier Socks Co. Ltd,"Huangdu Road, Xuanzhou District, Xuancheng, 242000, Anhui"
CN,Yiwu HongGuang Knitting Co. Ltd,"No. 16 Workshop, Langsha Industrial Zone, Yangcun Rd, Economic Development Area, Yiwu, 322000, Zhejiang"
RO,East Coast,"STR Timisorii NR 143-147, Lugoj, 305500, Timis"
CN,"ZHEJIANG OUTLOOK OPTICAL MANUFACTORY CO., LTD.","No. 12 Shengye Road,, LuCheng Light Industry Specialized Zone, Wenzhou, 325019, Zhejiang"
IN,JVS SPORTING GOODS,"B-9, Sports Goods Complex , Delhi Road, Meerut, 250001, Uttar Pradesh"
ID,PT Gistex,"Jl Raya Bandung Cirebon Desa Sinarjati, RT 01 RW01, Dawuan, Majalengka, 45453, Jawa Barat"
ID,PT Taitat Putra Rejeki,"JI Industri No.54 , Tarikolot, Citeureup, Bogor, 16180, Jawa Barat"
IT,Silcon Plastic S.R.L.,"ZONA INDUSTRIALE 2,, FORNO DI ZOLDO Belluno,, FORNO DI ZOLDO Belluno, 32012, Veneto"
JP,"Syuyusya Co.,Ltd.","5-1-10, shinozaki-machi, Edogawa-ku, 133-0061, Tokyo"
JP,Yorks Co Ltd,"609-2 Minato, Higashi Kagawa, 769-2798, Kagawa"
PK,Crown Textile Unit No.II,"Plot No. D-249/C1,, S.I.T.E, KARACHI, 75840, Sindh"
CN,"Ningbo Jinkang Industry Co., Ltd","No 1 Yuzhaojiang Road, Yuyao City, 315400, Zhejiang"
PK,N.F.K. Exports (Pvt) Ltd.,"F-748/C, SITE, KARACHI, 75700, Sindh"
PL,Euro-pegaz Logistyka Sp. z.o.o. - 2,"Centrum Logistyczne, Rozdzieskiego 12, Dabrowa Gornicza, 41-300, Slaskie"
ES,"Sampling Innovations Barcelona, S.L.","C/ Placa nova, 1, Santa Perpetua de la Mogoda, 8202, "
LK,Hirdaramani Mercury Apparel (Pvt) Ltd - Kirindiwela,"Lot 3, Maligawatte, kirindiwela, 11730, Western"
TW,"Elysian Enterprise Co., Ltd.","No. 5 JuiHsing Street, ChungHsing Industrial Park, Tongluo,, Miaoli, 36647, Taiwan"
TW,"SUN SIGHT GLASSES CO., LTD.","No.25 Lane 150 Sec.2 An Ho Rd., Annan District (70967), Tainan, 70967, Taiwan"
TW,"Yao I Fabric Co.,Ltd","No.13 Lugong N.1st Rd, Lukang Township, Changhua County, 50544, Taiwan"
TH,"Nan Yang Garment Co., Ltd. 3","168,170,172 Moo1,Phetkasem Rd.,, Sampran, 73110, Nakhon Pathom"
TR,Erateks Tekstil Sanayi ve Ticaret A.Ş. ,"Zafer Mah. 140. Sok. No:45 /1, Esenyurt/Istanbul, PK 34513, Istanbul"
US,PHARMASOL CORPORATION,"1 Norfolk Ave., Easton, 2375, Massachusetts"
VN,"Fashion Garments 2 Co., Ltd","Road 3, Bien Hoa Industry zone 1, Bien Hoa city, Dong Nai Province, Bien Hoa, 71000, Dong Nai"
VN,"Haivina Kim Lien Co., Ltd.","NAM GIANG INDUSTRIAL COMPLEX,, NAM GIANG COMMUNE, NAM DAN DISTRICT, 460000, Nghe An"
VN,"Jasan socks Vietnam Co., LTD","No.2, Road 17, Vsip Hai Phong Township,  Industrial & Service Park, Thuy Trieu ward,, Thuy Nguyen district, Hai Phong city, 180000, Thanh Pho Hai Phong"
CN,"Jiangsu Tianhai Garments Co.,Ltd","NO.8,Tianhai Road, Guoyuan, Changjiang Town, Rugao City, 226542, Jiangsu"
VN,"Shilla Glovis Viet Nam Co., LTD","Cho Moi Hamlet, Long Hoa Commune, Go Cong Town, Tien Giang Province, Viet Nam, Tien Giang, 860000, Tien Giang"
VN,Thuan Phuong Embroideries Garments Company Limited Binh Chanh Factory,"D15/8 Dinh Duc Thien, Hamlet 4, Binh Chanh Commune, Binh Chanh District, Thanh pho Ho Chi Minh"
CN,JINJIANG DALI GARMENTS & WEAVING Co. Ltd.,"Donghaian Industrial Zone, Shenhu Town, jinjiang, 362200, Fujian"
CN,JunYang (FuQing) Travel Appliances Co Ltd,"No. 336 Longjiang Road, Fuqing County, Fuzhou City, 350300, Fujian"
CN,"Lexi (Ningbo) Garment Co., Ltd.","Panhuo Inudstrial Zone, Sonjiang Road , Ningbo, Zhejiang , Ningbo , 315100, Zhejiang"
CN,"Lianyungang Taiyoung Fashion Co., Ltd.","No. 998 Jingdudadao Economic Industrial Park, Donghai, Lianyungang, 222300, Jiangsu"
CN,"Mingle (China) co ltd,.","Xiban Industrial District,Chendai Town,Jinjiang, jinjiang, 362211, Fujian"
CN,"Nanjing Saga Garment Co., Ltd.","28 Fengze Road,, JiangNing district,, Nanjing city,, 211103, Jiangsu"
CN,Nantong City Taierjia Knitting Garment Co.Ltd.,"No. 1 Chengxi Road, Rugao City, 226575, Jiangsu"
AT,Silhouette International,"Elbognerstrasse 24,  Linz, 4021"
BD,Uni Gears LTD,"Badshamia School Road, Khailkur, Board Bazar, Gazipur, 1704, Dhaka"
KH,I-CHENG CORPORATION,"NATIONAL ROAD, NO. 3, PHUM TANG DONG, KHUM TANG DONG, SROK BATY, 21311, Takeo"
CA,LEK Inc.,"315 Knowlton Road, Knowlton, J0E 1V0, Quebec"
CN,Baijia (Fujian) Underwear Co Ltd,"Baijia Industrial Park , Shenhu Town, jinjiang, 362246, Fujian"
PK,DK FITNESS (PVT) LTD.,"SAIDPUR ROAD, Sialkot, 51310, Punjab"
CN,Cheng Guan Sport Product Technology Co. ltd,"Xin cheng Industrial Park, Liao Bu Town, Dongguan, 523426, Guangdong"
CN,DIXON SPORTS,"No. 150 Heping Rd North, Yingde, Guangdong"
CN,Dongguan Chunlee Watch Company Limited,"No.47,Street 7,, Long Yan Park, Humen Town,, Dongguan, 511761, Guangdong"
CN,Dongguan Surewin Watch Company Limited,"Block 6, Bai Da Industrial Zone, Bai Guo Dong District, Zhang Mutou Town, Dongguan, 523638, Guangdong"
CN,GP2 Xinfeng Plant Limited,"No.63, XinFeng Industrial Park, XinFeng County, GanZhou, 341600, Jiangxi"
CN,HeShan YaYao Zeng Zhao Shoes Factory ,"No. 136, Xing Ya Road, YaYao Industrial Area, YaYao Town, HeShan, 529700, Guangdong"
CN,Huayuan Headwear Manufacturing Co. Ltd ,"1099 Xiushan West Road, Haimen, 226100, Jiangsu"
CN,"Nantong Huiyuan Plastic Products Co., Ltd","No.26, Su Chi Village, Liuqiao Town,Tongzhou City, Nantong, 226300, Jiangsu"
CN,"Ningbo Fenghua Hengyi Garments Co., Ltd.","NUMBER 48, HENGAN ROAD, FANGQIAO INDUSTRIAL, JIANGKOU STREET, FENGHUA, Ningbo , 315514, Zhejiang"
CN,Ningbo Kelly Fashions,"Wangjiaqiao town, Yinzhou district, Ningbo City, 315100, "
CN,Qingdao Huahe Knitting Co Ltd,"NO.301  HUANGHE 2 ROAD ,JIMO QINGDAO, Jimo, Qingdao, 266200, Shandong"
CN,Quanzhou Hecheng Bags Co. Ltd,"Tangxi Industrial Zone, Wanan Street , Luojiang District, Quanzhoou, 362000, Fujian"
CN,Q-Yield Outdoor Gear Ltd. ,"No. 9 Dongfu West 2nd Road, Haicang, Xiamen, 361027, Fujian"
CN,Shandong Gunze Apparel Ltd.,"Dongfeng Group Industry Zone Mingshui Economic  Zone,, Zhangqiu, 250200, Shandong"
CN,Shanghai Yutuo Knitting Co. Ltd,"NO 118 KANBEI ROAD, SITUAN TOWN, FENGXIAN DISTRICT, Shanghai, 201412, Shanghai Shi"
CN,"SHENG COMPOSITE TECH CO., LTD (XIAMEN)","38TH HULI INDUSTRIAL PARK, MEIXI ROAD, XIKE TOWN, Xiamen, 361100, Fujian"
CN,Shenzhen HeiYun Packing Co Ltd,"Building 48 & 1/F to 3/F of Building 47,, Bao-Tian Industrial Zone, Oian-Jin 2 Rd, XiXiang, Baoan District , Shenzhen City , 518102, Guangdong"
CN,"Subsidiary Factory of Zhejiang Hongyao Socks Co, Ltd","No. 42, Chuntang Road,, Caota Town,, Zhuji, 311820, Zhejiang"
CN,"Suzhou Jiahua Biochemistry Co., Ltd.","No. 688 GuoQing Road, Lili Town, Wujiang, SUZHOU, 215212, Jiangsu"
CN,TIAN JIN YIN MEI GARMENT COMPANY LIMITED,"MAJIADIAN INDUSTRIAL AREA OF , BAODI COUNTY, Tianjin, 301800, Tianjin Shi"
CN,Worthpak Manufacturing Limited,"Shanbaotan Industrial Zone, Shipai Town, Donguan City, 523335, Guangdong"
CN,XIAMEN B-SHENG COMPOSITE TECH CO LTD,"100 Simingyuan, Tongan Jizhong Industrial, Tongan District, Xiamen , 361022, Fujian"
CN,"Xiamen Mydo Sports Equipment Co., Ltd.","No. 30, Bannan Road, Dongfu Street, Haicang District, Xiamen, 361026, Fujian"
CN,"Xinxing Xin De Run Garment Co., Ltd","Guangxing Avenue, Dongyao, Dongcheng Town, Xinxing County, Yunfu, 527400, Guangdong"
CN,YIA-CHYNS TEXTILE (SHANGHAI) CORP,"BUILDING 2, NO.688 FENG YONG ROAD, FENGXIAN DISTRICT, Shanghai, 201414, Shanghai Shi"
CN,"Young Sporting Goods (Suzhou) Co., Ltd.","No.498 ChangAn Road, Wujiang Economic & Technological Development Zone, SUZHOU, 215200, Jiangsu"
CN,Zhejiang Arcana Power Health Tech Co Ltd,"Nr 618 Xinxing Avenue , Zonghan,Emerging Industrial Area, Cixi, Cixi, 515000, Zhejiang"
RU,JSC Arnest,"Kombinatskaya str, 6, Nevinnomyssk, 357107, Stavropol'skiy"
CN,"Zhejiang Hongyao Socks Co.,Ltd.","NO. 88 HANG JIN QI VILLAGE, CAOTA TOWN, Zhuji, 311812, Zhejiang"
CN,"Zhejiang Meixina Garment Co., Ltd","No. 366 Xiwang Road, Jindong Economic Development Zone, JinHua, 321036, Zhejiang"
CN,"Zhejiang Shaxue Underwear Co., Ltd.","No. 100 Qianan Road, Fotang Town, Yiwu, 322023, Zhejiang"
CN,Zhongshan WeiLi Textile Co. Ltd.,"The second Industrial Area, SanXiang Town, Zhongshan, 528463, Guangdong"
CN,ZhuCheng RiLi Garments Co. LTD.,"South west end of mianzhi street , Zhucheng, Shandong  province , Zhucheng, 262200, Shandong"
CZ,Ravensburger Karton s.r.o. (RKC),"Strizezska 968,  , Policka, 57201, "
EG,Ahmed Ahmed Abbas for Readymade Garments,"El Andalus St, El Bagour, Menofia, 2002, Al Minufiyah"
EG,T.M.I EGYPT,"STREET NO.9 AMRIYA PUBLIC FREE ZONE,  ALEXANDRIA    , 23512,  ALEXANDRIA    "
SV,Impression Apparel Group S.A. de C.V.,"Blvd. Del Ejercito Km 8 1/2 Y Calle Cooperativa Algodonera, Edificio 1, Soyapango, San Salvador, "
DE,DÖHLER GMBH,"Riedstraße 7-9, Darmstadt, 64295, "
HT,GO HAITI,"39 PARC INDUSTRIEL, SONAPI, RTE DE L’AEROPORT, PORT-AU-PRINCE, HT00043, "
HN,POLYGRAPHIC,"GREEN VALLEY INDUSTRIAL PARK, QUIMISTAN, N/A, Santa Barbara"
ID,PT Dada Indonesia,"Jl. Raya Sadang, Ciwangi, Kec. Bungursari, Purwakarta, 41118, Jawa Barat"
ID,PT Gistex Garmen Indonesia,"Jl. Panyawungan KM. 19 Cileunyi, Wetan Kabupaten Bandung , Bandung, 40622, Jawa Barat"
TW,"Jack Pan Co., Ltd.","No.9, Qianliao Rd., Shengang Dist.,, Taichung, 429, "
ID,PT KANAAN GLOBAL INDONESIA,"JL. Ronggolawe RT.02/18 Kel. Telukan, Kec. Grogol Kab. , Sukoharjo, 57552, Jawa Tengah"
ID,PT. Harindotama Mandiri,"Kapuk Kamal Muara No.88, Tegal Alur,, Kalideres, Jakarta Barat, Jakarta, 11820, Daerah Khusus Ibukota Jakarta"
ID,PT. Ricky Gunze,"JL. Industry No.54, Tarikolot Citeureup, Bogor, 16810, Jawa Barat"
IT,Dal Dosso Sport snc,"Via Aldo Moro, 9, 28011 Armeno (NO), Armeno, 28011, Lombardia"
IT,Gloria Srl,"Via Torino, 101, Leini, Torino, 10040, Piemonte"
JP,"Seed Co.,Ltd.","3-5-25 Uchindai-cho, Miyakojima-ku, 534-0013, Osaka"
JP,TOA-STRINGS Oita Factory,"81-2, Karishuku, Oaza, Kitsuki-City, 873-0031, Oita"
JP,"Yamagata Mitsubishi Pencil Precision Co.,ltd.","4026-1, kamikomatsu, kawanishi-machi, 999-0121, Yamagata"
JP,YUI KOUBOU CO. LTD,"497-6 Yamanokami Machi, Ota-Shi, 379-2302 , Gunma"
PK,Anwar Khawaja Composite,"Anwar Khawaja Yard, Sadra Badra, Daska road, Sialkot, 51310, Punjab"
KR,Saramsarang,"306 , GUNYOUNG B/D, 1188-1, JUKJEON-DONG, SUJI-GU,, YONGIN-CITY, 3393, Gyeonggi-do"
MY,Gallant Industries (M) Sdn Bhd,"LOT 73351 JALAN PENGKALAN, LAHAT, 31/500 Lahat, LAHAT IPOH, 31500, Perak"
MX,Tecnosol S.A. de C.V.,"Alce Blanco 49, Fraccionamiento Industrial Alce Blanco, Naucalpan, 53370, Mexico"
NL,Eurobottle BV,"Pioniersweg 32, Dronten, 8251 KN, Flevoland"
PK,Forward Sports (PVT) Ltd,"P.B. Box 1704, Adda Sahowala, Wazirabad Road, Sialkot, 51310, Punjab"
PK,Mansha & Brothers PVT.Ltd.,"Wazirabad Road, Ugoki, Sialkot, 51310, Punjab"
PK,Starpak Martial Arts (Pvt) Ltd,"6-Km,, Wazirabad Road near Noul,, Sialkot, 51310, Punjab"
PK,XPRO Sportswear PVT. LLC.,"Near Catholic Church, AADHA, Daska Road, Sialkot, 51310, Punjab"
PL,ColepCCL Polska,"Ul. Przemyslowa 10, Kleszczów, 97-410, Lodz"
PT,"4teams - Advertising & Merchandising, Lda.","Rua da Industria, 89, PO Box 160, Vizela, 4815-901, Minho"
RO,S.C. PROGRESS S.A.,"STREET:FANTANII,27A,, Brasov,, 500482, "
ES,"GRAFOPACK, S.A.","Ctra. N-II, Km. 557, Odena, 8711, "
ES,MANIPULADOS MICSOS S.L.,"Avinguda de Sant Julià, 125 - 127, Granollers, 8403, Catalunya"
ES,Prohima Internacional S.A.,"Crta. N-II, Km. 644 - Torre d'Ara, Mataró, 8302, Catalunya"
VN,Shilla Bags International,"CHANH HAMLET,, DUC LAP HA COMMUNE, DUC HOA DISTRICT, Duc Hoa Town, 81000, Long An"
LK,Ceylon Knit Trend (Pvt) Limited,"Divurumpitiya, Getahetta, Eheliyagoda, 70620, Sabaragamuwa"
SY,Majed & Mohamed Alzayed Company,"Shahnaya, Daraa International Higway, PO Box 197, Damascus, 197, Dimashq"
TW,Chengyi Optical Co Ltd,"No.42, Industrial 2nd Road, An Nan District, Tainan, 709, "
TW,Dyaco International Inc.,"No 1 Gong 1st Rd, Gyuan Sing Industrial Park, Hemei Town, Changhua County, 508, Taiwan"
TW,HO CHENG SPORTS MFG. CO. LTD.,"NO. 22, LANE 23, ZHONGYANG ROAD,, YONGKANG, TAINAN CITY, Tainan, 71045, Taiwan"
TW,Lien Yei Garment Factory,"No. 413 Section 2, Ching Yun Road, Tou Chen Town, I-lan Hsing, YILAN COUNTY, 261, Taiwan"
TW,"Racer Sporting Goods Co., Ltd.","17 Kung 6 Rd,, Linkou 2nd Ind. Park, New Taipei City, 24450, Taiwan"
TW,REN-E Sports Goods Co Ltd,"No 168, 14 Alley, Nan Yang 6 Rd, Sha Lu, Taichung Hsien, 433, "
TW,Twou Tson Enterprise Co. Ltd.,"No. 50, Lane 33, Sec 5, Chung Ho St. , Shin Sheh District, Taichung City, 42643, Taiwan"
TH,"Milott Laboratories Co., Ltd.","84/55 Moo 11 Soi Tanasit, Teparak Road, Bangpla, Bangplee, Bangplee, 10540, Samut Prakan"
US,"Hydro Graphics, Inc.","705 S. Springbrook Rd. Suite A100, Newberg, 97132, Oregon"
TH,Nan Yang Garment Co Ltd,"27 Phetkasem 71 Road, Nongkangploo, Nongkham, Bangkok, 10160, Bangkok"
TH,"New Asia Sports Goods Co., Ltd","55 Suwintawong Rd., Kratumrai, Nongchok, Bangkok, 10530, Thailand., Bangkok, 10530, Bangkok"
TH,"UNIVERSAL SPORTING GOODS (THAI) CO., LTD.","91/1 MOO1 SOI WATTHIEN-DAD, PETCHKASEM RD., BAN-MAI, SAMPHARN, Nakhonpathom, 73110, Nakhon Pathom"
GB,Echelon Sport Ltd,"Unit D, Zenith Park, Whaley Road, Barnsley, South Yorkshire, Barnsley, S75 1HT , England"
US,Coty US LLC,"1400 Broadway Road, Sanford, 27332, North Carolina"
US,Penn Prints Inc,"7110 Center Drive, Spartanburg, 29303, South Carolina"
VN,Chuan Mei Glove (Vietnam) Co. Ltd.,"Tan Thuan Export Processing Zone, NO. 12 Street, District 7, Ho Chi Minh City, 70999, "
VN,"Fashion Garments 2 Co., Ltd - Tan Phu Branch","Road 3, Tan Phu Industrial Zone, Tan Phu District , Bien Hoa, 71000, Dong Nai"
VN,"Fashion Garments Mekong Co., Ltd","814B, Highway 30, Hamlet 3, An Hoa Commune, Tam Nong District,, 870000, Dong Thap"
VN,Ivory Trieu Son Thanh Hoa Co.Ltd,"Hamlet 4 - Tho Vuc commune - Trieu Son district - Thanh Hoa province, Trieu Son, 440000, Thanh Hoa"
VN,"JC Int’l Vina Co., Ltd","Hoa Lan Quarter, Thuan Giao Ward, Thuan An Town, Binh Duong Province, Binh Duong, 72000, Binh Duong"
VN,Lawnyard Vietnam Co. Ltd.,"F4-F6 RD4, Industry Zone Le Minh Xuan, Binh Chanh District, Ho Chi Minh, Not Applicable, "
VN,Sonha Company Ltd,"Group 2, Dong Khoi Street, Tan Hiep Ward, Bien Hoa City, N/A, Dong Nai"
VN,TNG Investment & Trading JSC - Dai Tu Branch,"Thang Loi Ward, Tien Hoi Commune, Dai Tu District, 250000, 1, 250000, Thai Nguyen"
VN,"United Swimwear Apparel Co.,Ltd","Lot C1, Suoi Dau Industrial Zone , Cam Lam District , Cam Lam District , 57000, Khanh Hoa"
ZA,Indigo Brands (Pty) Ltd.,"16-20 Evans Avenue, Epping 1, Cape Town, 7460, Western Cape"
CN,"IDT Electronics(Shenzhen) Co., Ltd","2nd floor, Block 31, XiXiang Chentian Industrial Estate, XiXiang Town, BaoAn County, Shenzhen, 518102, Guangdong"
CN,Jiangsu Qian Li Ma Stockings Co. Ltd.,"Dong Lai Development Area, Yang She Town, Zhang Jia Gang, 215600, Jiangsu"
CN,Jilin Province Northeast Socks Industry Park Hosiery Knitting Co. Ltd ,"Building F6, Northeast Socks Textile Industry Park, Economic Development Zone, Liaoyuan, 136200, Jilin"
CN,K-pack Company Ltd,"3rd Building No.3 , Industrial Zone, Tiantou, Hengli Town, Dongguan, 523478, Guangdong"
CN,"KunShan XinHanTang Textile Products Co., Ltd.","Building 3 and 4, No. 198, HuaXia Road,, LuJia Town,, Kunshan, 215337, Jiangsu"
CN,"Lianyungang Uidea  Industry Co.,Ltd","A8 building, small-sized  enterprise park, West area, Economic development  district, Donghai, Lianyungang, 222300, Jiangsu"
CN,"Morito (Shenzhen) Co., Ltd.","A District, Yuhong Industry Zone, Heyi Village, Shajing Town, Bao An District, Shenzhen, 518104, Guangdong"
CN,Nan Jing Gather Europe Headwear Manufacture Co. Ltd.,"ROOM 402, NO.16 FENGHUI AVENUE, YUHUA ECONOMIC DEVELOPMENT ZONE, Nanjing, 210039, Jiangsu"
AT,Erdal GesmbH & Co KG,"Neualmerstr.13, Hallein, 5400, Salzburg"
BR,Savoy Indústria de Cosméticos S.A.,"Rua Contorno Oeste, SN, Quadra 01 / Lote 01/16 / Módulo 01, Polo Coureiro, Senador Canedo, 75250-000, Goias"
KH,Hulu Garment Co ltd,"Phum Chak Chrouk, Sangkat Samrong Kram,, Khan Dangkor, Phnom Penh,, Kingdon Of Cambodia, Phnom Penh, 12400, "
CN,"Automax Anhui Co., Ltd.","No. 2 Building, 123 Intelligent Knitting Park, Intersection of East Road & Yinglin Road, Yingshang Economic Development Zone, Fuyang, 236200, Anhui"
CN,BAOJI HAWK IND. & TRADE CO. LTD,"No. 17 Chencang Middle Road, Chencang District,Baoji City,   , Baoji , 721300, Shanxi"
CN,Quanzhou Mutuzhe Garments Co Ltd,"No.75th. Zhitai Road, Economic Development Zone, Quanzhou, Fujian"
CN,Bonny Composite-Tech(Tongxiang)LTD.,"No. 199,East Fengxiang Road, Tongxiang, 314500, Zhejiang"
CN,ChangZhou QingQing Knitting Factory,"1/F, Block D,, No. 1315, JinSha Avenue,, JinTan District,, ChangZhou, 213234, Jiangsu"
CN,Dalian Ichihiro Towel Co Ltd,"Dongbei 3rd Street, No.11, Dalian Economic & Technical Development Zone, Dalian, 116600, Liaoning"
CN,"DEJET INDUSTRY CO., LTD.","No 518, Zhengtong Rd, Kandun Industry Zone, Cixi,, Cixi, Ningbo City, Zhejiang, 315303, Zhejiang"
CN,"Rongcheng City Yu Chang Sports Co., Ltd.","Rongcheng City West Town Industrial Park, Weihai Rongcheng, 264300, Shandong"
CN,"Dongguan Oak Sports Goods Co., Ltd. ","No. 1 Keyuan 4th Road Tangxia Town, Dongguan  City, 523718, Guangdong"
CN,DONGGUAN SHUOKE PLASTIC&METAL PRODUCTION  CO ,"3th INDUSTRIAL JINSHAN VILLAGE  CHASHAN TOWN, Dongguan, 523399, Guangdong"
CN,DONGKOU CHANGGUANLONG SPORTING GOODS CO.,"Dongkou Economic Development Zone, Dongkou County, Hunan Province, Shaoyang, 422300, Hunan"
CN,"HangZhou  Jasan Socks Co.,Ltd","No. 111 JinYi Road,, XiaoShan Economic Developing Zone, Hangzhou, 311215, Zhejiang"
CN,"Xiangshui Maoda Textile Technology Co., Ltd","No.8 , Yin hai Rd, Economic Development Zone, Yancheng City  , Jiangsu"
